#***************************************************************************

#sjplacer

#Version:            1.1

#Build Date:         Oct  1 2015 13:46:59

#File Generated:     Feb 1 2016 14:00:54

#Purpose:            

#Copyright (C) 2010-2011 by Softjin Technologies Pvt Ltd. All rights reserved.

#***************************************************************************

Executing : C:\Program Files (x86)\Cypress\PSoC Creator\3.3\PSoC Creator\bin/sjplacer.exe --proj-name robot --netlist-vh2 robot_p.vh2 --arch-file C:\Program Files (x86)\Cypress\PSoC Creator\3.3\PSoC Creator\dev/arch/p4_udb2x2.ark --rrg-file C:\Program Files (x86)\Cypress\PSoC Creator\3.3\PSoC Creator\dev/psoc4/3/route_arch-rrg.cydata --irq-file C:\Program Files (x86)\Cypress\PSoC Creator\3.3\PSoC Creator\dev/psoc4/3/irqconn.cydata --dsi-conn-file C:\Program Files (x86)\Cypress\PSoC Creator\3.3\PSoC Creator\dev/psoc4/3/dsiconn.cydata --pins-file pins_56-QFN.xml --lib-file robot_p.lib --sdc-file robot.sdc --io-pcf robot.pci --outdir .

		Softjin Techologies Placer, Version 1.1

Build Date : Oct  1 2015	13:44:59

D2004: Option and Settings Summary
=============================================================
Netlist vh2 file          - robot_p.vh2
Architecture file         - C:\Program Files (x86)\Cypress\PSoC Creator\3.3\PSoC Creator\dev/arch/p4_udb2x2.ark
Package                   - 
Defparam file             - 
SDC file                  - robot.sdc
Output directory          - .
Timing library            - robot_p.lib
IO Placement file         - robot.pci

D2050: Starting reading inputs for placer
=============================================================
D2065: Reading netlist file : "robot_p.vh2"
D2065: Reading arch file : "C:\Program Files (x86)\Cypress\PSoC Creator\3.3\PSoC Creator\dev/arch/p4_udb2x2.ark"
D2051: Reading of inputs for placer completed successfully

D2053: Starting placement of the design
=============================================================

Phase 2
Phase 3

Design Statistics after Packing
    Number of Combinational MCs 	:	3
    Number of Sequential MCs    	:	7
    Number of DPs               	:	2
    Number of Controls          	:	2
    Number of Status            	:	2
    Number of SyncCells         	:	0
    Number of count7cells       	:	0

Device Utilization Summary after Packing
    Macrocells                  :	10/32
    UDBS                        :	2/4
    IOs                         :	14/38


D2088: Phase 3, elapsed time : 0.0 (sec)

Phase 4
D2088: Phase 4, elapsed time : 0.0 (sec)

Phase 6

######################################################################
Placement Timing Summary

The timing summary is based on estimated routing delays after
placement. For final timing report, please carry out the timing
analysis after routing.
======================================================================

######################################################################
                     Clock Summary 
======================================================================
Number of clocks: 11
Clock: Clock_1              | Frequency:  53.4 MHz | Target:   0.0 MHz
Clock: Clock_2              | Frequency: N/A       | Target:   0.0 MHz
Clock: Clock_2(FFB)         | Frequency: N/A       | Target:   0.0 MHz
Clock: CyECO                | Frequency: N/A       | Target:  24.0 MHz
Clock: CyHFCLK              | Frequency: N/A       | Target:  48.0 MHz
Clock: CyILO                | Frequency: N/A       | Target:   0.0 MHz
Clock: CyIMO                | Frequency: N/A       | Target:  48.0 MHz
Clock: CyLFCLK              | Frequency: N/A       | Target:   0.0 MHz
Clock: CyRouted1            | Frequency: N/A       | Target:  48.0 MHz
Clock: CySYSCLK             | Frequency: N/A       | Target:  48.0 MHz
Clock: CyWCO                | Frequency: N/A       | Target:   0.0 MHz

======================================================================
                     End of Clock Summary
######################################################################

D2088: Phase 6, elapsed time : 0.0 (sec)

Phase 7
######################################################################
                     Clock Summary 
======================================================================
Number of clocks: 11
Clock: Clock_1              | Frequency:  53.4 MHz | Target:   0.0 MHz
Clock: Clock_2              | Frequency: N/A       | Target:   0.0 MHz
Clock: Clock_2(FFB)         | Frequency: N/A       | Target:   0.0 MHz
Clock: CyECO                | Frequency: N/A       | Target:  24.0 MHz
Clock: CyHFCLK              | Frequency: N/A       | Target:  48.0 MHz
Clock: CyILO                | Frequency: N/A       | Target:   0.0 MHz
Clock: CyIMO                | Frequency: N/A       | Target:  48.0 MHz
Clock: CyLFCLK              | Frequency: N/A       | Target:   0.0 MHz
Clock: CyRouted1            | Frequency: N/A       | Target:  48.0 MHz
Clock: CySYSCLK             | Frequency: N/A       | Target:  48.0 MHz
Clock: CyWCO                | Frequency: N/A       | Target:   0.0 MHz

======================================================================
                     End of Clock Summary
######################################################################
D2088: Phase 7, elapsed time : 0.0 (sec)

Final Design Statistics
    Number of Combinational MCs 	:	3
    Number of Sequential MCs    	:	7
    Number of DPs               	:	2
    Number of Controls          	:	2
    Number of Status            	:	2
    Number of SyncCells         	:	0
    Number of count7cells       	:	0
    Number of IOs       	:	14

Device Utilization Summary
    Macrocells                  :	10/32
    IOs                         :	14/38



######################################################################
Placement Timing Summary

The timing summary is based on estimated routing delays after
placement. For final timing report, please carry out the timing
analysis after routing.
======================================================================


######################################################################
                     Clock Summary 
======================================================================
Number of clocks: 11
Clock: Clock_1              | Frequency:  53.4 MHz | Target:   0.0 MHz
Clock: Clock_2              | Frequency: N/A       | Target:   0.0 MHz
Clock: Clock_2(FFB)         | Frequency: N/A       | Target:   0.0 MHz
Clock: CyECO                | Frequency: N/A       | Target:  24.0 MHz
Clock: CyHFCLK              | Frequency: N/A       | Target:  48.0 MHz
Clock: CyILO                | Frequency: N/A       | Target:   0.0 MHz
Clock: CyIMO                | Frequency: N/A       | Target:  48.0 MHz
Clock: CyLFCLK              | Frequency: N/A       | Target:   0.0 MHz
Clock: CyRouted1            | Frequency: N/A       | Target:  48.0 MHz
Clock: CySYSCLK             | Frequency: N/A       | Target:  48.0 MHz
Clock: CyWCO                | Frequency: N/A       | Target:   0.0 MHz

======================================================================
                     End of Clock Summary
######################################################################

Phase 8
D2088: Phase 8, elapsed time : 0.0 (sec)

D2054: Placement of the design completed successfully

I2076: Total run-time: 0.3 sec.

